{
  "$schema": "urn:openaix:schema:measure-area:0.2.0-draft.1",
  "active": {
    "end": "2026-10-02T15:00:00Z",
    "start": "2026-10-02T13:00:00Z"
  },
  "description": "Restrictive fire area over a friendly logistics site south of the FLOT.",
  "geometry": {
    "kind": "polygon",
    "rings": [
      [
        {
          "latitude": 34.715,
          "longitude": 40.225
        },
        {
          "latitude": 34.715,
          "longitude": 40.325
        },
        {
          "latitude": 34.775,
          "longitude": 40.325
        },
        {
          "latitude": 34.775,
          "longitude": 40.225
        },
        {
          "latitude": 34.715,
          "longitude": 40.225
        }
      ]
    ]
  },
  "id": "juniper-wash-rfa",
  "name": "Juniper Wash RFA",
  "restrictions": [
    "No improved conventional munitions.",
    "Fires that exceed these restrictions require coordination with the land force fire support element."
  ],
  "type": "RFA"
}
